filename,goodforairplane,BoxOffice,DVD,Production,Website,actors,awards,country,director,genre,imdbID,imdbRating,imdbVotes,language,metascore,plot,poster,rated,released,runtime,title,tomatoConsensus,tomatoFresh,tomatoImage,tomatoMeter,tomatoRating,tomatoReviews,tomatoRotten,tomatoUserMeter,tomatoUserRating,tomatoUserReviews,type,writer,year
Robin_Hood,1,$105.2M,21-Sep-10,Universal,http://www.robinhoodthemovie.com/,"Russell Crowe, Cate Blanchett, Max von Sydow, William Hurt",1 win & 15 nominations.,"USA, UK",Ridley Scott,"Action, Adventure, Drama",tt0955308,6.7,"192,013","English, French",53,"Birth of a legend. Following King Richard's death in France, archer Robin Longstride, along with Will Scarlett, Alan-a-Dale and Little John, returns to England. They encounter the dying Robert of Locksley, whose party was ambushed by treacherous Godfrey, who hopes to facilitate a French invasion of England. Robin promises the dying knight he will return his sword to his father Walter in Nottingham. Here Walter encourages him to impersonate the dead man to prevent his land being confiscated by the crown, and he finds himself with Marian, a ready-made wife. Hoping to stir baronial opposition to weak King John and allow an easy French take-over, Godfrey worms his way into the king's service as Earl Marshal of England and brutally invades towns under the pretext of collecting Royal taxes. Can Robin navigate the politics of barons, royals, traitors, and the French?",http://ia.media-imdb.com/images/M/MV5BMTM5NzcwMzEwOF5BMl5BanBnXkFtZTcwNjg5MTgwMw@@._V1_SX300.jpg,PG-13,14-May-10,140 min,Robin Hood,"Ridley Scott's revisionist take on this oft-told tale offers some fine acting and a few gripping action sequences, but it's missing the thrill of adventure that made Robin Hood a legend in the first place.",103,rotten,43,5.4,239,136,58,3.5,264400,movie,"Brian Helgeland (screenplay), Brian Helgeland (story), Ethan Reiff (story), Cyrus Voris (story)",2010
Seventh_Son,1,N/A,26-May-15,Universal,http://www.seventhsonmovie.com,"Jeff Bridges, Ben Barnes, Julianne Moore, Alicia Vikander",N/A,"USA, UK, Canada, China",Sergey Bodrov,"Action, Adventure, Fantasy",tt1121096,5.5,"20,293",English,30,"John Gregory, who is a seventh son of a seventh son and also the local spook, has protected his country from witches, boggarts, ghouls and all manner of things that go bump in the night. However John is not young anymore, and has been seeking an apprentice to carry on his trade. Most have failed to survive. The last hope is a young farmer's son named Thomas Ward. Will he survive the training to become the spook that so many others couldn't? Should he trust the girl with pointy shoes? How can Thomas stand a chance against Mother Malkin, the most dangerous witch in the county?",http://ia.media-imdb.com/images/M/MV5BMjAxNTg2MDkyN15BMl5BanBnXkFtZTgwNzA3NzY1MjE@._V1_SX300.jpg,PG-13,6-Feb-15,102 min,Seventh Son,"Seventh Son squanders an excellent cast and some strange storyline ingredients, leaving audiences with one disappointingly dull fantasy adventure.",13,rotten,13,3.8,104,91,38,2.9,50126,movie,"Charles Leavitt (screenplay), Steven Knight (screenplay), Matt Greenberg (screen story), Joseph Delaney (novel)",2014
Shakespeare_in_Love,1,N/A,10-Aug-99,Miramax,http://www.miramax.com/mm_front/owa/mp.entryPoint?action=0&midStr=742,"Geoffrey Rush, Tom Wilkinson, Steven O'Donnell, Tim McMullan",Won 7 Oscars. Another 60 wins & 73 nominations.,USA,John Madden,"Comedy, Drama, Romance",tt0138097,7.2,"159,626",English,87,"Will Shakespeare is a known but struggling poet, playwright and actor who not only has sold his next play to both Philip Henslow and Richard Burbidge but now faces a far more difficult problem: he is bereft of ideas and has yet to begin writing. He is in search of his muse, the woman who will inspire him but all attempts fail him until he meets the beautiful Viola de Lesseps. She loves the theatre and would like nothing more than to take to the stage but is forbidden from doing so as only men can be actors. She is also a great admirer of Shakespeare's works. Dressing as a man and going by the name of Thomas Kent, she auditions and is ideal for a part in his next play. Shakespeare soon sees through her disguise and they begin a love affair, one they know cannot end happily for them as he is already married and she has been promised to the dour Lord Wessex. As the company rehearses his new play, Will and Viola's love is transferred to the written page leading to the masterpiece that is Romeo and Juliet.",http://ia.media-imdb.com/images/M/MV5BMTc0ODI2NDk2OV5BMl5BanBnXkFtZTcwNTIzNDQ4OQ@@._V1_SX300.jpg,R,8-Jan-99,123 min,Shakespeare in Love,"Endlessly witty, visually rapturous, and sweetly romantic, Shakespeare in Love is a delightful romantic comedy that succeeds on nearly every level.",115,certified,92,8.3,125,10,80,3.4,225524,movie,"Marc Norman, Tom Stoppard",1998
Some_Like_It_Hot,1,N/A,22-May-01,United Artists,http://www.fjtlesoiseaux.fr/cinema.html,"Marilyn Monroe, Tony Curtis, Jack Lemmon, George Raft",Won 1 Oscar. Another 13 wins & 9 nominations.,USA,Billy Wilder,Comedy,tt0053291,8.3,"151,910",English,N/A,"When two Chicago musicians, Joe and Jerry, witness the the St. Valentine's Day massacre, they want to get out of town and get away from the gangster responsible, Spats Colombo. They're desperate to get a gig out of town but the only job they know of is in an all-girl band heading to Florida. They show up at the train station as Josephine and Daphne, the replacement saxophone and bass players. They certainly enjoy being around the girls, especially Sugar Kane Kowalczyk who sings and plays the ukulele. Joe in particular sets out to woo her while Jerry/Daphne is wooed by a millionaire, Osgood Fielding III. Mayhem ensues as the two men try to keep their true identities hidden and Spats Colombo and his crew show up for a meeting with several other crime lords.",http://ia.media-imdb.com/images/M/MV5BNzYzMDkzNDQ0N15BMl5BanBnXkFtZTcwNzQ0NDQyNA@@._V1_SX300.jpg,NOT RATED,29-Mar-59,120 min,Some Like It Hot,N/A,47,certified,96,8.9,49,2,94,4.1,80835,movie,"Billy Wilder (screenplay), I.A.L. Diamond (screenplay), Robert Thoeren (suggested by a story by), Michael Logan (suggested by a story by)",1959
Still_Alice,0,$18.5M,12-May-15,Sony Pictures Classics,http://sonyclassics.com/stillalice/,"Julianne Moore, Kate Bosworth, Shane McRae, Hunter Parrish",Won 1 Oscar. Another 33 wins & 11 nominations.,"USA, France","Richard Glatzer, Wash Westmoreland",Drama,tt3316960,7.5,"31,198",English,72,"Alice Howland is a renowned linguistics professor happily married with three grown children. All that begins to change when she strangely starts to forget words and then more. When her doctor diagnoses her with Early-onset Alzheimer's Disease, Alice and her family's lives face a harrowing challenge as this terminal degenerative neurological ailment slowly progresses to an inevitable conclusion they all dread. Along the way, Alice struggles to not only to fight the inner decay, but to make the most of her remaining time to find the love and peace to make simply living worthwhile.",http://ia.media-imdb.com/images/M/MV5BMjIzNzAxNjY1Nl5BMl5BanBnXkFtZTgwMDg4ODQxMzE@._V1_SX300.jpg,PG-13,20-Feb-15,101 min,Still Alice,"Elevated by a gripping performance from Julianne Moore, Still Alice is a heartfelt drama that honors its delicate themes with bravery and sensitivity.",133,certified,89,7.5,150,17,86,4,28004,movie,"Lisa Genova (novel), Richard Glatzer (screenplay), Wash Westmoreland (screenplay)",2014
The_Babadook,1,N/A,13-Apr-15,IFC Films,N/A,"Essie Davis, Noah Wiseman, Hayley McElhinney, Daniel Henshall",40 wins & 52 nominations.,"Australia, Canada",Jennifer Kent,"Drama, Horror, Thriller",tt2321549,6.9,"61,938",English,86,"Amelia, who lost her husband in a car crash on the way to give birth to Samuel, their only child. She struggles to cope with her fate as a single mom. Samuel's constant fear of monsters and violent reaction to overcome the fear doesn't help her cause either, which makes her friends become distant. When things can not get any worse, they read a strange book in their house about the 'Babadook' monster that hides in the dark areas of their house. Even Amelia seems to feel the effect of Babadook and desperately tries in vain to destroy the book. The nightmarish experiences the two encounter form the rest of the story.",http://ia.media-imdb.com/images/M/MV5BMTk0NzMzODc2NF5BMl5BanBnXkFtZTgwOTYzNTM1MzE@._V1_SX300.jpg,NOT RATED,28-Nov-14,93 min,The Babadook,"The Babadook relies on real horror rather than cheap jump scares -- and boasts a heartfelt, genuinely moving story to boot.",163,certified,98,8.2,167,4,74,3.7,25386,movie,Jennifer Kent,2014
The_Birdcage,1,N/A,25-Mar-97,MGM Home Entertainment,N/A,"Robin Williams, Gene Hackman, Nathan Lane, Dianne Wiest",Nominated for 1 Oscar. Another 6 wins & 17 nominations.,USA,Mike Nichols,Comedy,tt0115685,6.9,"56,851",English,72,"Armand Goldman owns a popular drag nightclub in South Miami Beach. His long-time lover, Albert, stars there as Starina. &quot;Their&quot; son Val (actually Armand's by his one heterosexual fling, twenty years before) comes home to announce his engagement to Barbara Keeley, daughter of Kevin Keeley, US Senator, and co-founder of the Committee for Moral Order. The Senator and family descend upon South Beach to meet Val, his father and &quot;mother.&quot; What ensues is comic chaos.",http://ia.media-imdb.com/images/M/MV5BMTM2NjExODYyOF5BMl5BanBnXkFtZTcwNTc0NjgyNA@@._V1_SX300.jpg,R,8-Mar-96,117 min,The Birdcage,"Mike Nichols wrangles agreeably amusing performances from Robin Williams and Nathan Lane in this fun, if not quite essential, remake of the French comedy La Cage aux Folles.",37,certified,79,6.7,47,10,81,3.3,103960,movie,"Jean Poiret (play), Francis Veber (earlier screenplay), Edouard Molinaro (earlier screenplay), Marcello Danon (earlier screenplay), Jean Poiret (earlier screenplay), Elaine May (screenplay)",1996
The_Blair_Witch_Project,1,N/A,26-Oct-99,Artisan Pictures,http://www.blairwitch.com,"Heather Donahue, Joshua Leonard, Michael C. Williams, Bob Griffin",13 wins & 18 nominations.,USA,"Daniel Myrick, Eduardo Sanchez","Horror, Mystery",tt0185937,6.4,"168,745",English,81,"Three film students travel to Maryland to make a student film about a local urban legend... The Blair Witch. The three went into the woods on a two day hike to find the Blair Witch, and never came back. One year later, the students film and video was found in the woods. The footage was compiled and made into a movie. The Blair Witch Project.",http://ia.media-imdb.com/images/M/MV5BMTg0NjMyNTY4OF5BMl5BanBnXkFtZTYwOTMxOTY4._V1_SX300.jpg,R,30-Jul-99,81 min,The Blair Witch Project,"Full of creepy campfire scares, mock-doc The Blair Witch Project keeps audiences in the dark about its titular villain -- thus proving that imagination can be as scary as anything onscreen.",134,certified,87,7.7,154,20,55,2.5,399152,movie,"Daniel Myrick, Eduardo Sanchez",1999
The_Book_of_Life,1,N/A,27-Jan-15,20th Century Fox,http://www.bookoflifemovie.com/,"Diego Luna, Zoe Saldana, Channing Tatum, Ron Perlman",Nominated for 1 Golden Globe. Another 1 win & 22 nominations.,USA,Jorge R. Gutierrez,"Animation, Adventure, Comedy",tt2262227,7.3,"28,822","English, Spanish",67,"From producer Guillermo del Toro and director Jorge Gutierrez comes an animated comedy with a unique visual style. THE BOOK OF LIFE is the journey of Manolo, a young man who is torn between fulfilling the expectations of his family and following his heart. Before choosing which path to follow, he embarks on an incredible adventure that spans three fantastical worlds where he must face his greatest fears. Rich with a fresh take on pop music favorites, THE BOOK OF LIFE encourages us to celebrate the past while looking forward to the future.",http://ia.media-imdb.com/images/M/MV5BMTkzOTgzNDYzOF5BMl5BanBnXkFtZTgwOTgxMTkyMjE@._V1_SX300.jpg,PG,17-Oct-14,95 min,The Book of Life,"The Book of Life's gorgeous animation is a treat, but it's a pity that its story lacks the same level of craft and detail that its thrilling visuals provide.",87,certified,82,7,106,19,78,4,46197,movie,"Jorge R. Gutierrez, Douglas Langdale",2014
The_Bourne_Legacy,0,$113.2M,11-Dec-12,Universal Pictures,http://www.thebournelegacy.com/,"Jeremy Renner, Scott Glenn, Stacy Keach, Edward Norton",1 win & 11 nominations.,"USA, Japan",Tony Gilroy,"Action, Adventure, Mystery",tt1194173,6.7,"201,225","English, Russian, Filipino",61,"The events in this movie take place around the same time as the events in The Bourne Ultimatum (2007). When a British reporter was writing an expose about Black Ops operations Treadstone and Black Briar, and the ones responsible for them are concerned. And when Jason Bourne, former Treadstone operative got the file on Treadstone and Black Briar and gave it to Pamela Landy who then passed it to the media. When the men behind Treadstone and Black Briar learn of this, they're concerned how this will affect other ops they have. They decide it's best to shut down all ops and make sure make everyone involved disappears. They try to take out Aaron Cross who is part of another op called Outcome, but he manages to survive. He then seeks out Dr. Marta Shearing who worked on him when he began. It seems part of the program is for all subjects to take medications but he has run out, which is why he seeks her. But someone tries to kill her. He saves her and she tells him, he should have stopped taking the medications long ago. They go to Manila so that she can help him. Later the men behind Outcome learn that Cross and Shearing are still alive. They try to get them.",http://ia.media-imdb.com/images/M/MV5BMTc4Njk3MDM1Nl5BMl5BanBnXkFtZTcwODgyOTMxOA@@._V1_SX300.jpg,PG-13,10-Aug-12,135 min,The Bourne Legacy,"It isn't quite as compelling as the earlier trilogy, but The Bourne Legacy proves the franchise has stories left to tell -- and benefits from Jeremy Renner's magnetic work in the starring role.",119,rotten,55,5.8,215,96,59,3.5,280647,movie,"Tony Gilroy (screenplay), Dan Gilroy (screenplay), Tony Gilroy (story)",2012
The_Cobbler,0,N/A,12-May-15,RLJ/Image Entertainment,http://www.watchimage.com/product/cobbler-the/756d2d75-0f69-e411-b9bd-b8ac6f1142,"Adam Sandler, Method Man, Adam B. Shapiro, Ellen Barkin",N/A,USA,Thomas McCarthy,"Comedy, Drama, Fantasy",tt3203616,5.8,"13,768","English, Yiddish",22,"Max Simkin repairs shoes in the same New York shop that has been in his family for generations. Disenchanted with the grind of daily life, Max stumbles upon a magical heirloom that allows him to step into the lives of his customers and see the world in a new way. Sometimes walking in another man's shoes is the only way one can discover who they really are.",http://ia.media-imdb.com/images/M/MV5BMTgzMjQ2OTQ0NV5BMl5BanBnXkFtZTgwMTc2MTI2NDE@._V1_SX300.jpg,PG-13,13-Mar-15,99 min,The Cobbler,"The Cobbler represents a slight step up from Adam Sandler's recent comedies, but while its cloying sentiment proves a more palatable substitute for his usual crass humor, it still isn't terribly compelling.",5,rotten,11,3.1,46,41,35,2.8,4218,movie,"Thomas McCarthy, Paul Sado",2014
The_Dark_Knight,0,$533.3M,9-Dec-08,Warner Bros. Pictures,http://thedarkknight.warnerbros.com/,"Christian Bale, Heath Ledger, Aaron Eckhart, Michael Caine",Won 2 Oscars. Another 137 wins & 106 nominations.,"USA, UK",Christopher Nolan,"Action, Crime, Drama",tt0468569,9,"1,415,902","English, Mandarin",82,"Batman raises the stakes in his war on crime. With the help of Lieutenant Jim Gordon and District Attorney Harvey Dent, Batman sets out to dismantle the remaining criminal organizations that plague the city streets. The partnership proves to be effective, but they soon find themselves prey to a reign of chaos unleashed by a rising criminal mastermind known to the terrified citizens of Gotham as The Joker.",http://ia.media-imdb.com/images/M/MV5BMTMxNTMwODM0NF5BMl5BanBnXkFtZTcwODAyMTk2Mw@@._V1_SX300.jpg,PG-13,18-Jul-08,152 min,The Dark Knight,"Dark, complex and unforgettable, The Dark Knight succeeds not just as an entertaining comic book film, but as a richly thrilling crime saga.",296,certified,94,8.6,315,19,94,4.4,1816099,movie,"Jonathan Nolan (screenplay), Christopher Nolan (screenplay), Christopher Nolan (story), David S. Goyer (story), Bob Kane (characters)",2008
The_Fault_in_Our_Stars,0,$124.9M,16-Sep-14,20th Century Fox,http://www.facebook.com/faultinourstarsmovie,"Shailene Woodley, Ansel Elgort, Nat Wolff, Laura Dern",18 wins & 11 nominations.,USA,Josh Boone,"Drama, Romance",tt2582846,8,"186,646",English,69,"Hazel and Augustus are two teenagers who share an acerbic wit, a disdain for the conventional, and a love that sweeps them on a journey. Their relationship is all the more miraculous, given that Hazel's other constant companion is an oxygen tank, Gus jokes about his prosthetic leg, and they meet and fall in love at a cancer support group.",http://ia.media-imdb.com/images/M/MV5BMjA4NzkxNzc5Ml5BMl5BanBnXkFtZTgwNzQ3OTMxMTE@._V1_SX300.jpg,PG-13,6-Jun-14,126 min,The Fault in Our Stars,"Wise, funny, and heartbreaking without resorting to exploitation, The Fault In Our Stars does right by its bestselling source material.",158,certified,81,6.9,196,38,86,4.2,105243,movie,"Scott Neustadter (screenplay), Michael H. Weber (screenplay), John Green (book)",2014
The_Great_Gatsby,0,$144.8M,27-Aug-13,Warner Bros. Pictures,http://thegreatgatsby.warnerbros.com/,"Lisa Adam, Frank Aldridge, Amitabh Bachchan, Steve Bisley",Won 2 Oscars. Another 43 wins & 63 nominations.,"Australia, USA",Baz Luhrmann,"Drama, Romance",tt1343092,7.3,"309,540",English,55,"An adaptation of F. Scott Fitzgerald's Long Island-set novel, where Midwesterner Nick Carraway is lured into the lavish world of his neighbor, Jay Gatsby. Soon enough, however, Carraway will see through the cracks of Gatsby's nouveau riche existence, where obsession, madness, and tragedy await.",http://ia.media-imdb.com/images/M/MV5BMTkxNTk1ODcxNl5BMl5BanBnXkFtZTcwMDI1OTMzOQ@@._V1_SX300.jpg,PG-13,10-May-13,143 min,The Great Gatsby,While certainly ambitious -- and every bit as visually dazzling as one might expect -- Baz Luhrmann's The Great Gatsby emphasizes visual splendor at the expense of its source material's vibrant heart.,124,rotten,48,5.8,257,133,68,3.7,206461,movie,"Baz Luhrmann (screenplay), Craig Pearce (screenplay), F. Scott Fitzgerald (based on the novel by)",2013
The_Hobbit__The_Desolation_of_Smaug,1,$258.4M,8-Apr-14,Warner Bros.,http://www.thehobbit.com/index.html,"Ian McKellen, Martin Freeman, Richard Armitage, Ken Stott",Nominated for 3 Oscars. Another 15 wins & 74 nominations.,"USA, New Zealand",Peter Jackson,"Adventure, Fantasy",tt1170358,8,"407,097",English,66,"After successfully crossing over (and under) the Misty Mountains, Thorin and Company must seek aid from a powerful stranger before taking on the dangers of Mirkwood Forest--without their Wizard. If they reach the human settlement of Lake-town it will be time for the hobbit Bilbo Baggins to fulfill his contract with the dwarves. The party must complete the journey to Lonely Mountain and burglar Baggins must seek out the Secret Door that will give them access to the hoard of the dragon Smaug. And, where has Gandalf got off to? And what is his secret business to the south?",http://ia.media-imdb.com/images/M/MV5BMzU0NDY0NDEzNV5BMl5BanBnXkFtZTgwOTIxNDU1MDE@._V1_SX300.jpg,PG-13,13-Dec-13,161 min,The Hobbit: The Desolation of Smaug,"While still slightly hamstrung by 'middle chapter' narrative problems and its formidable length, The Desolation of Smaug represents a more confident, exciting second chapter for the Hobbit series.",160,certified,74,6.8,216,56,86,4.1,257341,movie,"Fran Walsh (screenplay), Philippa Boyens (screenplay), Peter Jackson (screenplay), Guillermo del Toro (screenplay), J.R.R. Tolkien (novel)",2013
The_Hunger_Games,1,$408.0M,18-Aug-12,Lionsgate,http://thehungergamesmovie.com,"Stanley Tucci, Wes Bentley, Jennifer Lawrence, Willow Shields",Nominated for 1 Golden Globe. Another 32 wins & 40 nominations.,USA,Gary Ross,"Adventure, Sci-Fi",tt1392170,7.3,"609,997",English,67,"In a dystopian future, the totalitarian nation of Panem is divided into 12 districts and the Capitol. Each year two young representatives from each district are selected by lottery to participate in The Hunger Games. Part entertainment, part brutal retribution for a past rebellion, the televised games are broadcast throughout Panem. The 24 participants are forced to eliminate their competitors while the citizens of Panem are required to watch. When 16-year-old Katniss' young sister, Prim, is selected as District 12's female representative, Katniss volunteers to take her place. She and her male counterpart, Peeta, are pitted against bigger, stronger representatives, some of whom have trained for this their whole lives.",http://ia.media-imdb.com/images/M/MV5BMjA4NDg3NzYxMF5BMl5BanBnXkFtZTcwNTgyNzkyNw@@._V1_SX300.jpg,PG-13,23-Mar-12,142 min,The Hunger Games,"Thrilling and superbly acted, The Hunger Games captures the dramatic violence, raw emotion, and ambitious scope of its source novel.",232,certified,84,7.2,276,44,81,4.1,896744,movie,"Gary Ross (screenplay), Suzanne Collins (screenplay), Billy Ray (screenplay), Suzanne Collins (novel)",2012
The_Hunger_Games__Catching_Fire,0,$424.6M,7-Mar-14,Lionsgate Films,http://www.thehungergamesexplorer.com/us/,"Jennifer Lawrence, Liam Hemsworth, Jack Quaid, Taylor St. Clair",Nominated for 1 Golden Globe. Another 24 wins & 52 nominations.,USA,Francis Lawrence,"Adventure, Sci-Fi",tt1951264,7.7,"417,269",English,75,"Six months after winning the 74th Hunger Games, Katniss Everdeen and her partner Peeta Mellark must go on what is known as the Victor's Tour, wherein they visit all the districts, but before leaving, Katniss is visited by President Snow who fears that Katniss defied him a year ago during the games when she chose to die with Peeta. With both Katniss and Peeta declared the winners, it is fueling a possible uprising. He tells Katniss that while on tour she better try to make sure that she puts out the flames or else everyone she cares about will be in danger.",http://ia.media-imdb.com/images/M/MV5BMTAyMjQ3OTAxMzNeQTJeQWpwZ15BbWU4MDU0NzA1MzAx._V1_SX300.jpg,PG-13,22-Nov-13,146 min,The Hunger Games: Catching Fire,"Smart, smoothly directed, and enriched with a deeper exploration of the franchise's thought-provoking themes, Catching Fire proves a thoroughly compelling second installment in the Hunger Games series.",220,certified,89,7.5,247,27,90,4.3,418928,movie,"Simon Beaufoy (screenplay), Michael Arndt (screenplay), Suzanne Collins (novel)",2013
The_Imitation_Game,1,$91.1M,31-Mar-15,The Weinstein Company,http://theimitationgamemovie.com/,"Benedict Cumberbatch, Keira Knightley, Matthew Goode, Rory Kinnear",Won 1 Oscar. Another 51 wins & 118 nominations.,"UK, USA",Morten Tyldum,"Biography, Drama, Thriller",tt2084970,8.1,"254,249","English, German",73,"Based on the real life story of legendary cryptanalyst Alan Turing, the film portrays the nail-biting race against time by Turing and his brilliant team of code-breakers at Britain's top-secret Government Code and Cypher School at Bletchley Park, during the darkest days of World War II.",http://ia.media-imdb.com/images/M/MV5BNDkwNTEyMzkzNl5BMl5BanBnXkFtZTgwNTAwNzk3MjE@._V1_SX300.jpg,PG-13,25-Dec-14,114 min,The Imitation Game,"With an outstanding starring performance from Benedict Cumberbatch illuminating its fact-based story, The Imitation Game serves as an eminently well-made entry in the 'prestige biopic' genre.",203,certified,89,7.7,228,25,92,4.3,93065,movie,"Graham Moore, Andrew Hodges (book)",2014
The_Judge,0,$47.1M,27-Jan-15,Warner Bros. Pictures,http://thejudgemovie.com,"Robert Downey Jr., Robert Duvall, Vera Farmiga, Billy Bob Thornton",Nominated for 1 Oscar. Another 4 wins & 6 nominations.,USA,David Dobkin,Drama,tt1872194,7.5,"93,969",English,48,"Hank Palmer is a successful defense attorney in Chicago, who is getting a divorce. When His brother calls with the news that their mother has died, Hank returns to his childhood home to attend the funeral. Despite the brittle bond between Hank and the Judge, Hank must come to his father's aid and defend him in court. Here, Hank discovers the truth behind the case, which binds together the dysfunctional family and reveals the struggles and secrecy of the family.",http://ia.media-imdb.com/images/M/MV5BMTcyNzIxOTIwMV5BMl5BanBnXkFtZTgwMzE0NjQwMjE@._V1_SX300.jpg,R,10-Oct-14,141 min,The Judge,"Solidly cast and beautifully filmed but thoroughly cliched, The Judge seems destined to preside over a large jurisdiction of the basic cable afternoon-viewing circuit.",84,rotten,47,5.6,178,94,73,3.8,45130,movie,"Nick Schenk (screenplay), Bill Dubuque (screenplay), David Dobkin (story), Nick Schenk (story)",2014
