filename,goodforairplane,BoxOffice,DVD,Production,Website,actors,awards,country,director,genre,imdbID,imdbRating,imdbVotes,language,metascore,plot,poster,rated,released,runtime,title,tomatoConsensus,tomatoFresh,tomatoImage,tomatoMeter,tomatoRating,tomatoReviews,tomatoRotten,tomatoUserMeter,tomatoUserRating,tomatoUserReviews,type,writer,year
Let's_Be_Cops,1,$82.4M,11-Nov-14,20th Century Fox,http://www.letsbecops.com/,"Jake Johnson, Damon Wayans Jr., Rob Riggle, Nina Dobrev",1 nomination.,USA,Luke Greenfield,Comedy,tt1924435,6.5,"79,381",English,30,"Two struggling pals dress as police officers for a costume party and become neighborhood sensations. But when these newly-minted &quot;heroes&quot; get tangled in a real life web of mobsters and dirty detectives, they must put their fake badges on the line.",http://ia.media-imdb.com/images/M/MV5BMjI3MDY2ODQwNF5BMl5BanBnXkFtZTgwNjUzNjE4MTE@._V1_SX300.jpg,R,13-Aug-14,104 min,Let's Be Cops,"Damon Wayans, Jr. and Jake Johnson have comedic chemistry; unfortunately, Let's Be Cops fails to do anything with it.",13,rotten,18,3.8,71,58,53,3.4,60327,movie,"Luke Greenfield, Nicholas Thomas",2014
Live_Nude_Girls,0,N/A,15-Jun-04,Republic Pictures Home Video,N/A,"Dana Delany, Kim Cattrall, Cynthia Stevenson, Laila Robins",N/A,USA,Julianna Lavin,Comedy,tt0113674,5.4,"1,440",English,N/A,"Georgina throws a sleepover party for her friend Jamie, a moderately successful actress, on the night of Jamie's fiancee's bachelor party. Jill, Jamie, Marcy, Rachel, and Georgina have been friends since childhood, and as the evening progresses they talk about a variety of topics: Georgina's heterosexual fantasies and her uncertainties about Chris, her live-in lover; Jamie's doubts and insecurities about marriage; and all of their attitudes toward sex and sexual fantasies.",http://ia.media-imdb.com/images/M/MV5BMTQxMzEwMTQxN15BMl5BanBnXkFtZTcwMjI2NjY0MQ@@._V1_SX300.jpg,R,8-Dec-95,95 min,Live Nude Girls,N/A,3,rotten,38,4.4,8,5,41,3.2,1001,movie,Julianna Lavin,1995
Looney_Tunes__Back_in_Action,0,$20.9M,2-Mar-04,Warner Bros. Pictures,http://www2.warnerbros.com/looneytunesbackinaction/index.html,"Brendan Fraser, Jenna Elfman, Steve Martin, Timothy Dalton",9 nominations.,"USA, Germany",Joe Dante,"Animation, Adventure, Comedy",tt0318155,5.7,"20,879",English,64,"Bugs Bunny and Daffy Duck are up to their feuding ways again. Tired of playing second fiddle to Bugs, Daffy has decided to leave the Studio for good. He is aided by Warner Bros.' humor impaired Vice President of Comedy, Kate Houghton, who releases him from his contract and instructs WB security guard/aspiring stunt man DJ Drake to capture and &quot;escort&quot; Daffy off the studio lot. Suddenly a sidekick without a hero, the duck decides to ally himself with DJ, whether he likes it or not. Consequently, Daffy is on the scene when DJ discovers that his famous movie star father was Damian Drake, known for playing suave international spies onscreen, is actually a suave international spy in real life--and has been kidnapped by the evil insane nerdy, prancing villain known as Mr. Chairman of the equally nefarious Acme Corporation. It seems that Damian knows the whereabouts of the mysterious magical and powerful Blue Monkey Diamond, and the Chairman will do anything to get his hands on it! With Daffy in tow, DJ hits the road in a desperate attempt to outrace the evil Acme stooges to the diamond and save the world from their evil clutches. Unbeknownst to the two neo-spies, they are also being followed by VP Kate and Bugs--the studio brass has decided that the rabbit needs a comic foil after all, and Kate's job is on the line if she can't get Daffy back to work ASAP.",http://ia.media-imdb.com/images/M/MV5BMTkxNDk5MDQ2MF5BMl5BanBnXkFtZTYwMTA0Nzc2._V1_SX300.jpg,PG,14-Nov-03,91 min,Looney Tunes: Back in Action,"The plot is a nonsensical, hyperactive jumble and the gags are relatively uninspired compared to the classic Looney Tunes cartoons.",76,rotten,57,6,134,58,50,2.9,63070,movie,Larry Doyle,2003
Lord_of_the_Flies,0,N/A,20-Nov-01,Nelson Entertainment,N/A,"Balthazar Getty, Chris Furrh, Danuel Pipoly, James Badge Dale",3 nominations.,USA,Harry Hook,"Adventure, Drama, Thriller",tt0100054,6.4,"20,331",English,N/A,"After a plane crash in the ocean, a group of military students reach an island. Ralph organizes the boys, assigning responsibilities for each one. When the rebel Jack Merridew neglects the fire camp and they lose the chance to be seen by a helicopter, the group split under the leadership of Jack. While Ralph rationalizes the procedures, Jack returns to the primitivism, using the fear for the unknown (in a metaphor to the religion) to control the other boys, and hunting and chasing pigs, stealing the possession of Ralph's group and even killing people.",http://ia.media-imdb.com/images/M/MV5BOTI2NTQyODk0M15BMl5BanBnXkFtZTcwNTQ3NDk0NA@@._V1_SX300.jpg,R,16-Mar-90,90 min,Lord of the Flies,N/A,11,fresh,61,6.4,18,7,52,3.1,54078,movie,"William Golding (novel), Jay Presson Allen (screenplay)",1990
Maine_Pyar_Kiya,0,N/A,18-May-99,Rajshri Media,N/A,"Salman Khan, Bhagyashree, Alok Nath, Rajeev Verma",4 wins & 2 nominations.,India,Sooraj R. Barjatya,"Family, Musical, Romance",tt0100095,7.6,"4,391",Hindi,N/A,"Kishen Kumar Chaudhary and Karan are family like friends, when Kishen's wife Mrs. Kaushalya gives birth to a baby boy Prem, Karan helps the couple bring up there child with out- most care. Years later the two friends have parted ways, Karan likes in a shanty house, works as a mechanic and is the father to a young girl Suman while Kishen is a wealthy industrialist and lives in a spacious bungalow. In order to accumulate huge sums of fund abroad for good living Karan decides to leave Suman in the care of the Chaudhary's family. All is well there for Suman as she is befriend by Prem which eventually blossom to love, Kaushalya finds out about Prem and Suman's relationship and approve of Suman as her daughter-in-law but Kishen is quite unhappy with the relationship as he have plans to get Prem marry to his business partner's daughter Seema thus he insults Suman and throw her out of his house. Karan returns and is enraged at the treatment his daughter receive and leaves the house immediately with his daughter. Prem too is unhappy with his dad's decision and he also leaves the house opting to marry Suman with the blessings of Karan. But Karan refuses to accept Prem and the only way Prem can win Karan's approval is if he prove that he can earn money by his own sweat.",http://ia.media-imdb.com/images/M/MV5BMTM5NTg4MDIwN15BMl5BanBnXkFtZTgwMTY2ODk1MDE@._V1_SX300.jpg,N/A,N/A,192 min,Maine Pyar Kiya,N/A,N/A,N/A,N/A,N/A,N/A,N/A,89,4.2,5182,movie,"S.M. Ahale (story), Sooraj R. Barjatya (dialogue), Sooraj R. Barjatya (screenplay)",1989
Mean_Girls,0,$86.0M,21-Sep-04,Paramount Pictures,http://www.meangirlsmovie.com/indexflash.html,"Lindsay Lohan, Rachel McAdams, Tina Fey, Tim Meadows",7 wins & 19 nominations.,"USA, Canada",Mark Waters,Comedy,tt0377092,7,"206,869","English, German, Vietnamese, Swahili",66,"Her parents being zoologists, Cady Heron has never known what &quot;high school&quot; truly meant. She lived her first 15 years in the African jungle, home-schooled, living life with only her parents and the animals of the wilderness, knowing all of the rules of survival. However, when she moves out of Africa, she has to learn the rules of high school, a jungle in itself. She instantly makes friends with two sweet teenagers, Damian and Janis, who, in the terms of the high school, were in the &quot;out crowd.&quot; Soon she meets the Plastics, the three crude, beautiful, popular girls, consisting of Regina, the unofficial leader, Gretchen, Regina's full-time follower, and Karen, &quot;one of the dumbest people you will ever meet.&quot; They immediately let her into their group, but Cady, wanting to keep her first friends, is unsure. The two convince Cady to keep her relationship with the Plastics, only so that they can know their dark secrets. However, events turn for the worse when Cady falls for Regina's ex-boyfriend, Aaron Samuels. When Regina finds out, she seeks revenge of Cady by taking Aaron back. When Cady finds out, what began as a game to discover secrets turns into a plan to destroy Regina. Now, Cady, Janis, and Damian plot together to bring Regina's status down. However, as Cady spends more time with the Plastics, she, too, begins to become one.",http://ia.media-imdb.com/images/M/MV5BMjE1MDQ4MjI1OV5BMl5BanBnXkFtZTcwNzcwODAzMw@@._V1_SX300.jpg,PG-13,30-Apr-04,97 min,Mean Girls,Funnier and more smartly written than the average teen comedy.,146,certified,83,6.9,175,29,66,3,32162726,movie,"Rosalind Wiseman (book), Tina Fey (screenplay)",2004
Monsters_University,1,$268.5M,29-Oct-13,Walt Disney Pictures,http://www.disney.com/MonstersUniversity,"Billy Crystal, John Goodman, Steve Buscemi, Helen Mirren",Nominated for 1 BAFTA Film Award. Another 13 wins & 46 nominations.,USA,Dan Scanlon,"Animation, Adventure, Comedy",tt1453405,7.4,"190,674",English,65,"Mike Wazowski and James P. Sullivan are an inseparable pair, but that wasn't always the case. From the moment these two mismatched monsters met they couldn't stand each other. &quot;Monsters University&quot; unlocks the door to how Mike and Sulley overcame their differences and became the best of friends.",http://ia.media-imdb.com/images/M/MV5BMTUyODgwMDU3M15BMl5BanBnXkFtZTcwOTM4MjcxOQ@@._V1_SX300.jpg,G,21-Jun-13,104 min,Monsters University,"It doesn't scale the heights of Pixar's finest efforts, but Monsters University is still funny and thoughtful family entertainment for viewers of any age.",142,certified,78,6.8,182,40,82,4,302601,movie,"Dan Scanlon (story), Daniel Gerson (story), Robert L. Baird (story), Daniel Gerson (screenplay), Robert L. Baird (screenplay), Dan Scanlon (screenplay)",2013
Moulin_Rouge!,1,$55.1M,18-Dec-01,20th Century Fox,http://www.moulinrougemovie.com,"Nicole Kidman, Ewan McGregor, John Leguizamo, Jim Broadbent",Won 2 Oscars. Another 85 wins & 112 nominations.,"USA, Australia",Baz Luhrmann,"Drama, Musical, Romance",tt0203009,7.7,"206,698","English, French, Spanish",66,"The year is 1899, and Christian, a young English writer, has come to Paris to follow the Bohemian revolution taking hold of the city's drug and prostitute infested underworld. And nowhere is the thrill of the underworld more alive than at the Moulin Rouge, a night club where the rich and poor men alike come to be entertained by the dancers, but things take a wicked turn for Christian as he starts a deadly love affair with the star courtesan of the club, Satine. But her affections are also coveted by the club's patron: the Duke. A dangerous love triangle ensues as Satine and Christian attempt to fight all odds to stay together but a force that not even love can conquer is taking its toll on Satine...",http://ia.media-imdb.com/images/M/MV5BMTk5Mjg0MzM3MV5BMl5BanBnXkFtZTcwMTEyMjcxMQ@@._V1_SX300.jpg,PG-13,1-Jun-01,127 min,Moulin Rouge!,"A love-it-or-hate-it experience, Moulin Rouge is all style, all giddy, over-the-top spectacle. But it's also daring in its vision and wildly original.",146,certified,76,7.1,192,46,90,3.7,503261,movie,"Baz Luhrmann, Craig Pearce",2001
Mr._Go,1,N/A,N/A,N/A,N/A,"Dong-il Song, Jiao Xu, Hee-won Kim, Kang-woo Kim",2 wins & 1 nomination.,"South Korea, China",Yong-hwa Kim,"Comedy, Drama, Sport",tt2969458,6.3,531,"Korean, Mandarin",N/A,"Wei-wei, a 15-year old circus ringmaster of a falling troupe in China, is left behind an insurmountable debt when her grandfather dies in the Great Sichuan Earthquake. The only family/friend she can depend on is a forty-five year old &quot;baseball playing gorilla&quot; named Ling-ling. When a loan shark threatens to sell Ling-ling and the circus kids to cover the debt, Wei-wei has no choice but to allow Ling-ling to be scouted by the materialistic sports agent Sung Chung-su to play in the Korean Baseball League. Despite the skeptical of the professional baseball society, Sung Chung-su successfully signs Ling-ling with a professional team with his calculated plan and sweet talks. Ling-ling, now dubbed &quot;Mr. Go,&quot; hits consecutive home runs and brings victories to his team Doosan. His popularity grows so immensely that even the fans of his opposing teams cheer for him. Mr.Go's successful home-run parade continues, but Wei-wei and Sung, stunned and blinded by the sudden success, neglect to detect Ling-ling's worsening knee injury. When two rival Japanese baseball clubs compete to sign a scouting deal with &quot;Mr.Go&quot; by suggesting ground-breaking trade conditions to his agent Sung, &quot;Mr.Go&quot; suddenly falls to the ground and is unable to swing a bat...",http://ia.media-imdb.com/images/M/MV5BMTk2ODAxODEwOV5BMl5BanBnXkFtZTcwNTk5NjI3OQ@@._V1_SX300.jpg,N/A,17-Jul-13,132 min,Mr. Go,N/A,N/A,N/A,N/A,N/A,N/A,N/A,N/A,2.8,32,movie,Yong-hwa Kim (screenplay),2013
Mulan,1,N/A,9-Nov-99,Buena Vista,N/A,"Ming-Na Wen, Lea Salonga, June Foray, Soon-Tek Oh",Nominated for 1 Oscar. Another 17 wins & 20 nominations.,USA,"Tony Bancroft, Barry Cook","Animation, Adventure, Family",tt0120762,7.5,"139,484","English, Mandarin",71,"This retelling of the old Chinese folktale is about the story of a young Chinese maiden who learns that her weakened and lame father is to be called up into the army in order to fight the invading Huns. Knowing that he would never survive the rigours of war in his state, she decides to disguise herself and join in his place. Unknown to her, her ancestors are aware of this and to prevent it, they order a tiny disgraced dragon, Mushu to join her in order to force her to abandon her plan. He agrees, but when he meets Mulan, he learns that she cannot be dissuaded and so decides to help her in the perilous times ahead.",http://ia.media-imdb.com/images/M/MV5BMTIwNjY4NDU2NF5BMl5BanBnXkFtZTcwMzM0OTUyMQ@@._V1_SX300.jpg,G,19-Jun-98,88 min,Mulan,"Exploring themes of family duty and honor, Mulan breaks new ground as a Disney film, while still bringing vibrant animation and sprightly characters to the screen.",63,certified,86,7.5,73,10,84,3.4,608681,movie,"Robert D. San Souci (story), Rita Hsiao (screenplay), Chris Sanders (screenplay), Philip LaZebnik (screenplay), Raymond Singer (screenplay), Eugenia Bostwick-Singer (screenplay), Dean DeBlois (head writer), John Sanford (story), Tim Hodge (story), Burny Mattinson (story), Barry Johnson (story), Ed Gombert (story), Chris Williams (story), Julius Aguimatang (story), Lorna Cook (story), Thom Enriquez (story), Joe Grant (story), Floyd Norman (story), Linda Woolverton (additional story material), Jodi Ann Johnson (additional story material), Alan Ormsby (additional story material), David Reynolds (additional story material), Don Dougherty (additional story material), Jorgen Klubien (additional story material), Denis Rich (additional story material), Joe Ekers (additional story material), Theodore Newton (additional story material), Larry Scholl (additional story material), Daan Jippes (additional story material), Frank Nissen (additional story material), Jeff Snow (additional story material)",1998
My_Week_with_Marilyn,0,$14.6M,13-Mar-12,The Weinstein Company,http://myweekwithmarilynmovie.com/,"Michelle Williams, Eddie Redmayne, Julia Ormond, Kenneth Branagh",Nominated for 2 Oscars. Another 22 wins & 53 nominations.,"UK, USA",Simon Curtis,"Biography, Drama",tt1655420,7,"65,767","English, French",65,"Sir Laurence Olivier is making a movie in London. Young Colin Clark, an eager film student, wants to be involved and he navigates himself a job on the set. When film star Marilyn Monroe arrives for the start of shooting, all of London is excited to see the blonde bombshell, while Olivier is struggling to meet her many demands and acting ineptness, and Colin is intrigued by her. Colin's intrigue is met when Marilyn invites him into her inner world where she struggles with her fame, her beauty and her desire to be a great actress.",http://ia.media-imdb.com/images/M/MV5BMTYzODYwOTIzOV5BMl5BanBnXkFtZTcwODE2NjAwNw@@._V1_SX300.jpg,R,23-Dec-11,99 min,My Week with Marilyn,"Michelle Williams shines in My Week with Marilyn, capturing the magnetism and vulnerability of Marilyn Monroe.",135,certified,83,7.1,162,27,71,3.6,33952,movie,"Adrian Hodges (screenplay), Colin Clark (books)",2011
Night_at_the_Museum__Secret_of_the_Tomb,1,$113.6M,10-Mar-15,20th Century Fox,http://www.nightatthemuseummovie.com/,"Ben Stiller, Robin Williams, Owen Wilson, Steve Coogan",1 win & 2 nominations.,"USA, UK",Shawn Levy,"Adventure, Comedy, Family",tt2692250,6.3,"35,666",English,47,"At the Museum of Natural History, there's new exhibit being unveiled. Larry Daley who manages the night exhibit because the exhibits come to life because of the Tablet of Ahkmenrah, is in charge of the presentation. But when the exhibits go wild, Larry finds himself in trouble. He learns that the Tablet is corroding so he does some research and learns that Cecil, the former museum guard was at the site when the Tablet was discovered. He tells Larry that they were warned that if they remove it could mean the end. Larry realizes it means the end of magic. He talks to Ahkmenrah who says that he doesn't know anything. Only his father the Pharoah knows the Tablet's secrets. He learns that the Pharoah was sent to the London museum. So he convinces, Dr. McPhee the museum curator to help send him to London. He goes and takes Ahkmenrah with him but some of the others like Teddy Roosevelt, Attila, Octavius, and Jedediah come with him.",http://ia.media-imdb.com/images/M/MV5BMjI1MzM2ODEyMV5BMl5BanBnXkFtZTgwNTIzODAwMzE@._V1_SX300.jpg,PG,19-Dec-14,98 min,Night at the Museum: Secret of the Tomb,"While not without its moments, Night at the Museum: Secret of the Tomb is a less-than-inspired sendoff for the trilogy.",50,rotten,50,5,101,51,59,3.6,99156,movie,"David Guion (screenplay), Michael Handelman (screenplay), Mark Friedman (story), David Guion (story), Michael Handelman (story), Thomas Lennon (characters), Robert Ben Garant (characters)",2014
Nightcrawler,0,N/A,10-Feb-15,Open Road Films,http://nightcrawlerfilm.com/,"Jake Gyllenhaal, Michael Papajohn, Marco Rodriguez, Bill Paxton",Nominated for 1 Oscar. Another 46 wins & 75 nominations.,USA,Dan Gilroy,"Crime, Thriller",tt2872718,7.9,"183,055",English,76,"NIGHTCRAWLER is a thriller set in the nocturnal underbelly of contemporary Los Angeles. Jake Gyllenhaal stars as Lou Bloom, a driven young man desperate for work who discovers the high-speed world of L.A. crime journalism. Finding a group of freelance camera crews who film crashes, fires, murder and other mayhem, Lou muscles into the cut-throat, dangerous realm of nightcrawling - where each police siren wail equals a possible windfall and victims are converted into dollars and cents. Aided by Rene Russo as Nina, a veteran of the blood-sport that is local TV news, Lou blurs the line between observer and participant to become the star of his own story.",http://ia.media-imdb.com/images/M/MV5BMjM5NjkzMjE5MV5BMl5BanBnXkFtZTgwNTMzNTk4MjE@._V1_SX300.jpg,R,31-Oct-14,117 min,Nightcrawler,"Restless, visually sleek, and powered by a lithe star performance from Jake Gyllenhaal, Nightcrawler offers dark, thought-provoking thrills.",212,certified,95,8.2,223,11,86,4.1,73532,movie,Dan Gilroy,2014
Ode_to_My_Father,1,$2.3M,N/A,CJ Entertainment,http://www.cj-entertainment.com/movies/141117-001/ode-to-my-father,"Jeong-min Hwang, Yunjin Kim, Dal-su Oh, Jin-young Jung",N/A,South Korea,Youn Jk,Drama,tt3812366,7.5,232,"Korean, English, German",N/A,"Amid the chaos of refugees fleeing the Korean War in December 1950, a young boy, Duk-soo, sees his fate change in the blink of an eye when he loses track of his younger sister and he leaves his father behind to find her. Settling in Busan, Duk-soo devotes himself to his remaining family, working all manner of odd jobs to support them in place of his father. His dedication leads him first to the deadly coal mines of Germany, where he meets his first love, Youngja, and then to war-torn Vietnam in this generational epic about one man's personal sacrifices.",http://ia.media-imdb.com/images/M/MV5BNzU1ODg0NDUwN15BMl5BanBnXkFtZTgwNjY1MDQ1MzE@._V1_SX300.jpg,N/A,17-Dec-14,126 min,Ode to My Father,N/A,3,fresh,60,7,5,2,81,4.3,715,movie,Soo-jin Park,2014
Perez,0,N/A,N/A,N/A,N/A,"Luca Zingaretti, Marco D'Amore, Loredana Simioli, Edoardo De Angelis",N/A,Italy,Edoardo De Angelis,"Crime, Drama, Thriller",tt3552638,6.5,171,Italian,N/A,A lawyer has to cross the edge between law and crime to protect his family.,http://ia.media-imdb.com/images/M/MV5BMTU4OTU2OTgyMF5BMl5BanBnXkFtZTgwNjE0ODMzMjE@._V1_SX300.jpg,N/A,2-Oct-14,94 min,Perez.,N/A,N/A,N/A,N/A,N/A,N/A,N/A,N/A,4.2,3,movie,"Edoardo De Angelis, Filippo Gravino",2014
Predestination,0,N/A,10-Feb-15,Sony Pictures,http://www.facebook.com/PredestinationMovie,"Ethan Hawke, Sarah Snook, Christopher Kirby, Christopher Sommers",7 wins & 5 nominations.,Australia,"Michael Spierig, Peter Spierig","Drama, Mystery, Sci-Fi",tt2397535,7.4,"109,490",English,69,"PREDESTINATION chronicles the life of a Temporal Agent sent on an intricate series of time-travel journeys designed to ensure the continuation of his law enforcement career for all eternity. Now, on his final assignment, the Agent must pursue the one criminal that has eluded him throughout time.",http://ia.media-imdb.com/images/M/MV5BMTAzODc3NjU1NzNeQTJeQWpwZ15BbWU4MDk5NTQ4NTMx._V1_SX300.jpg,R,9-Jan-15,97 min,Predestination,"Fun genre fare with uncommon intelligence, Predestination serves as a better-than-average sci-fi adventure -- and offers a starmaking turn from Sarah Snook.",82,certified,84,6.8,98,16,74,3.7,18767,movie,"Michael Spierig, Peter Spierig, Robert A. Heinlein (story)",2014
Pulp_Fiction,0,N/A,19-May-98,Miramax Films,N/A,"Tim Roth, Amanda Plummer, Laura Lovelace, John Travolta",Won 1 Oscar. Another 63 wins & 47 nominations.,USA,Quentin Tarantino,"Crime, Drama",tt0110912,8.9,"1,117,616","English, Spanish, French",94,"Jules Winnfield and Vincent Vega are two hitmen who are out to retrieve a suitcase stolen from their employer, mob boss Marsellus Wallace. Wallace has also asked Vincent to take his wife Mia out a few days later when Wallace himself will be out of town. Butch Coolidge is an aging boxer who is paid by Wallace to lose his next fight. The lives of these seemingly unrelated people are woven together comprising of a series of funny, bizarre and uncalled-for incidents.",http://ia.media-imdb.com/images/M/MV5BMjE0ODk2NjczOV5BMl5BanBnXkFtZTYwNDQ0NDg4._V1_SX300.jpg,R,14-Oct-94,154 min,Pulp Fiction,"One of the most influential films of the 1990s, Pulp Fiction is a delirious post-modern mix of neo-noir thrills, pitch-black humor, and pop-culture touchstones.",70,certified,93,9,75,5,96,4.2,1117227,movie,"Quentin Tarantino (story), Roger Avary (story), Quentin Tarantino",1994
RED,0,$90.4M,25-Jan-11,Summit Entertainment,http://red-themovie.com/,"Bruce Willis, Mary-Louise Parker, Heidi von Palleske, Karl Urban",Nominated for 1 Golden Globe. Another 2 wins & 16 nominations.,USA,Robert Schwentke,"Action, Comedy, Crime",tt1245526,7.1,"214,189","English, Russian",60,"Frank (Bruce Willis) is retired, bored and lonely living off his government pension in a nondescript suburb in an equally nondescript house. The only joy in Frank's life are his calls to the government pension processing center when he gets to talk to his case worker Sarah (Mary-Louis Parker). Sarah is as bored and lonely as Frank and marks her conversations with the unknown Frank and her spy novels as the only things fun in her life. When something in Frank's past forces Frank back into his old line of work and puts an unwitting Sarah in the middle of the intrigue, Frank and Sarah begin a journey into Frank's past and the people he used to work with. Like Frank they are all RED ... Retired Extremely Dangerous.",http://ia.media-imdb.com/images/M/MV5BMzg2Mjg1OTk0NF5BMl5BanBnXkFtZTcwMjQ4MTA3Mw@@._V1_SX300.jpg,PG-13,15-Oct-10,111 min,RED,"It may not be the killer thrill ride you'd expect from an action movie with a cast of this caliber, but Red still thoroughly outshines most of its big-budget counterparts with its wit and style.",139,certified,71,6.3,196,57,72,3.7,134587,movie,"Jon Hoeber (screenplay), Erich Hoeber (screenplay), Warren Ellis (graphic novel), Cully Hamner (graphic novel)",2010
